{
  "$schema": "https://json-schema.org/draft/2020-12/schema",
  "title": "bom-offers",
  "type": "object",
  "additionalProperties": false,
  "required": [
    "$schema",
    "schema_version",
    "id",
    "record_type",
    "data"
  ],
  "properties": {
    "$schema": {
      "type": "string"
    },
    "schema_version": {
      "const": "1.0.0"
    },
    "id": {
      "type": "string",
      "minLength": 1
    },
    "record_type": {
      "const": "bom-offers"
    },
    "data": {
      "type": "object",
      "required": [
        "assembly_ref",
        "availability_status",
        "catalog_ref",
        "compatible_host_ref",
        "effective_from",
        "included_host",
        "kind",
        "licenses_and_services",
        "requirements",
        "shipping_date"
      ],
      "additionalProperties": false,
      "properties": {
        "assembly_ref": {
          "type": [
            "string"
          ],
          "minLength": 1
        },
        "availability_status": {
          "type": [
            "string"
          ]
        },
        "catalog_ref": {
          "type": [
            "string"
          ],
          "minLength": 1
        },
        "compatible_host_ref": {
          "type": [
            "string"
          ],
          "minLength": 1
        },
        "effective_from": {
          "type": [
            "string"
          ]
        },
        "included_host": {
          "type": [
            "boolean"
          ]
        },
        "kind": {
          "type": [
            "string"
          ]
        },
        "licenses_and_services": {
          "type": [
            "string"
          ]
        },
        "requirements": {
          "type": [
            "array"
          ]
        },
        "shipping_date": {
          "type": [
            "null",
            "string"
          ]
        },
        "variants": {
          "type": [
            "array"
          ]
        }
      }
    }
  }
}
