{
  "$schema": "../../../../schemas/records/bom-offers.schema.json",
  "schema_version": "1.0.0",
  "id": "bom.offers.bundle.aurelia_color",
  "record_type": "bom-offers",
  "data": {
    "catalog_ref": "bundle.aurelia_color",
    "kind": "system_bundle",
    "assembly_ref": "assembly.bundle.aurelia_color",
    "compatible_host_ref": "computer.aurelia",
    "included_host": true,
    "effective_from": "1978-06-05",
    "shipping_date": null,
    "availability_status": "catalog_offer",
    "requirements": [
      "Same, using Color I; use its separate OEM assembly and calibration cost, not a generic monitor allowance."
    ],
    "licenses_and_services": "Tracked outside recurring hardware BOM; physical media remains included."
  }
}
