{
  "$schema": "../../../../schemas/records/bom-offers.schema.json",
  "schema_version": "1.0.0",
  "id": "bom.offers.bundle.artemis_budget_128",
  "record_type": "bom-offers",
  "data": {
    "catalog_ref": "bundle.artemis_budget_128",
    "kind": "system_bundle",
    "assembly_ref": "assembly.bundle.artemis_budget_128",
    "compatible_host_ref": "computer.artemis",
    "included_host": true,
    "effective_from": "1980-05-19",
    "shipping_date": "1980-05-19",
    "availability_status": "scenario_qualified_shipment",
    "requirements": [
      "Budget model uses 128 KiB host and Color II; NIC added May 1981. Released BOM and 1980 qualification remain scenario engineering requirements. See artemis_budget_inputs.json for reproducible incremental cost buckets."
    ],
    "licenses_and_services": "AIONix, Business Tools, dated Abacus 3 and regular support counted once in budget assessment."
  }
}
