{
  "$schema": "../../../../schemas/records/bom-offers.schema.json",
  "schema_version": "1.0.0",
  "id": "bom.offers.bundle.aurelia_plus_mono",
  "record_type": "bom-offers",
  "data": {
    "catalog_ref": "bundle.aurelia_plus_mono",
    "kind": "system_bundle",
    "assembly_ref": "assembly.bundle.aurelia_plus_mono",
    "compatible_host_ref": "computer.aurelia_plus",
    "included_host": true,
    "effective_from": "1979-12-03",
    "shipping_date": null,
    "availability_status": "catalog_offer",
    "requirements": [
      "Tie to 64 KiB Plus board and two FDDs, Mono II, keyboard, exact cartridge/media and packout."
    ],
    "licenses_and_services": "Tracked outside recurring hardware BOM; physical media remains included."
  }
}
